{
  "defaults": {
    "read": {
      "format": "markdown"
    },
    "report": {
      "enabled": false
    },
    "thread": {
      "type": "new"
    },
    "wait": {
      "pollMs": 0,
      "stableMs": 0,
      "timeoutMs": 100
    }
  },
  "guardrails": [
    {
      "name": "no hidden prompt claims",
      "scope": "input"
    },
    {
      "name": "redact report previews",
      "scope": "report"
    }
  ],
  "instructions": "Use visible ChatGPT browser control honestly.",
  "instructionsMode": "visible_prefix",
  "kind": "chatgpt_browser_agent",
  "metadata": {
    "fixture": "runner_full_agent_config",
    "stability": "deterministic"
  },
  "name": "parity-reviewer",
  "output": {
    "onParseError": "error",
    "parse": "json",
    "sample": {
      "verdict": "ok"
    }
  },
  "tools": [
    {
      "command": "tools.select",
      "name": "web search",
      "risk": "medium"
    }
  ]
}
